{
  "schema": 1,
  "id": "nord-theme",
  "kind": "theme",
  "name": "Nord",
  "version": "1.0.0",
  "description": "A cool, muted dark palette based on the Nord colour scheme.",
  "author": "fella",
  "homepage": "https://github.com/Avijit-Kumar-GIT/fella-extensions/tree/main/packs/nord-theme",
  "license": "MIT",
  "payload": "theme.json"
}
