{
  "schema": 1,
  "id": "personal-finance",
  "kind": "skill",
  "name": "Personal Finance",
  "version": "1.0.0",
  "description": "Vocabulary and conventions for bank and card statements.",
  "author": "fella",
  "homepage": "https://github.com/Avijit-Kumar-GIT/fella-extensions/tree/main/packs/personal-finance",
  "license": "MIT",
  "payload": "skill.md"
}
